id,url,display_name,site_id,created_at,updated_at
1,http://arstechnica.com/science/2014/10/the-oceans-got-hotter-than-we-thought-but-the-heat-stayed-shallow/,"The oceans got hotter than we thought, but the heat stayed shallow",6,,
3,http://arstechnica.com/security/2014/10/adobes-e-book-reader-sends-your-reading-logs-back-to-adobe-in-plain-text/,Adobe’s e-book reader sends your reading logs back to Adobe—in plain text,6,,
2,http://arstechnica.com/information-technology/2014/10/markdown-throwdown-what-happens-when-foss-software-gets-corporate-backing/,Markdown throwdown: what happens when FOSS software gets corporate backing?,6,,
4,http://arstechnica.com/tech-policy/2014/10/lawsuit-reveals-samsung-paid-microsoft-1-billion-a-year-for-android-patents/,Lawsuit reveals Samsung paid Microsoft $1 billion a year for Android patents,6,,
5,http://arstechnica.com/information-technology/2014/10/chrome-surges-windows-8-x-falls-in-september/,"Chrome surges, Windows 8.x falls in September",6,,
6,http://www.nytimes.com/2014/10/08/us/politics/in-this-election-obamas-party-benches-him.html?hp&action=click&pgtype=Homepage&version=HpSum&module=first-column-region&region=top-news&WT.nav=top-news,President’s Own Party Benches Him in This Election,5,,
7,http://www.nytimes.com/2014/10/08/business/economy/why-federal-aid-for-higher-education-is-missing-the-mark.html?hp&action=click&pgtype=Homepage&version=HpSum&module=second-column-region&region=top-news&WT.nav=top-news,Why Aid for College Is Missing the Mark,5,,
8,http://www.nytimes.com/2014/10/08/business/30000-lose-health-care-coverage-at-walmart.html?hp&action=click&pgtype=Homepage&version=HpHeadline&module=second-column-region&region=top-news&WT.nav=top-news,"30,000 Lose Health Care Coverage at Walmart",5,,
9,http://www.nytimes.com/2014/10/07/business/microsoft-and-other-firms-pledge-to-protect-student-data.html?ref=technology,Microsoft and Other Firms Pledge to Protect Student Data,5,,
